### ISSUE TITLE
7.1.x breaks HTTP/2 PATCH

### ISSUE THREAD

**Issue by unixwitch** [apache/trafficserver#2076]
Using: Docker client (17.03.1) -> TS 7.1.x -> Docker Registry 2.6.1.

The Docker client makes an HTTP/2 PATCH request which TS translates into HTTP/1.1 with Transfer-Encoding: chunked.  Docker Registry rejects the request with the error "http: unexpected EOF reading trailer".  (According to the [source](https://golang.org/src/net/http/transfer.go), this means it failed to read the final empty chunk - not that it actually expected an HTTP trailer.)

Disabling HTTP/2 in TS (`proto=http`) fixes the problem.

I'm trying to reproduce this with a simpler test case...

**Comment by unixwitch** [comment]
This seems to be specific to chunked requests.

HTTP/1.1 request with chunked TE:
```
% cat /etc/hosts | curl --http1.1 -H'Transfer-Encoding: chunked' -v -si -XPATCH -d@- --resolve echoheaders.gce.t6x.uk:6443:127.0.0.1 https://echoheaders.gce.t6x.uk:6443/
```

Works fine; TS sends a chunked request to origin:

```
........PATCH / HTTP/1.1
User-Agent: curl/7.52.1
Accept: */*
Transfer-Encoding: chunked
Content-Type: application/x-www-form-urlencoded
Host: echoheaders.gce.t6x.uk
X-Forwarded-Proto: https
X-Forwarded-For: 127.0.0.1
Via: https/1.1 lnxdev[62707c09-39fb-4c99-8074-e5d3a84552e4] (ApacheTrafficServer/7.1.0)


05:20:10.182863 IP 172.28.5.2.8080 > 172.31.231.2.45058: Flags [.], ack 309, win 235, options [nop,nop,TS val 85328552 ecr 13243077], length 0
E..4L.@.@.................N7........Dg.....
........
05:20:10.183003 IP 172.31.231.2.45058 > 172.28.5.2.8080: Flags [P.], seq 309:552, ack 1, win 229, options [nop,nop,TS val 13243077 ecr 85328518], length 243: HTTP
E..'..@.<.e{..................N7.....r.....
........e8
127.0.0.1       localhost127.0.1.1      lnxdev.home     lnxdev# The following lines are desirable for IPv6 capable hosts::1     localhost ip6-localhost ip6-loopbackff02::1 ip6-allnodesff02::2 ip6-allrouters10.10.0.1 ilythia10.10.0.2 generator.test
0


05:20:10.183014 IP 172.28.5.2.8080 > 172.31.231.2.45058: Flags [.], ack 552, win 243, options [nop,nop,TS val 85328552 ecr 13243077], length 0
E..4L.@.@.................N7........Dg.....
........
05:20:10.183274 IP 172.28.5.2.8080 > 172.31.231.2.45058: Flags [P.], seq 1:776, ack 552, win 243, options [nop,nop,TS val 85328553 ecr 13243077], length 775: HTTP: HTTP/1.1 200 OK
E..;L.@.@.................N7........Gn.....
........HTTP/1.1 200 OK
```

HTTP/2 with chunked TE (triggered by telling cURL to send the TE header, but it actually uses HTTP/2 chunking):

```
cat /etc/hosts | curl  -H'Transfer-Encoding: chunked' -v -si -XPATCH -d@- --resolve echoheaders.gce.t6x.uk:6443:127.0.0.1 https://echoheaders.gce.t6x.uk:6443/
```

Does not work.  TS does not send the request body at all in that case:

```
05:20:55.989093 IP 172.31.231.2.45060 > 172.28.5.2.8080: Flags [P.], seq 1:281, ack 1, win 229, options [nop,nop,TS val 13254523 ecr 85374324], length 280: HTTP
E..L..@.<.^..............*..>..V....    ......
..?{...tPATCH / HTTP/1.1
User-Agent: curl/7.52.1
Accept: */*
Content-Type: application/x-www-form-urlencoded
Host: echoheaders.gce.t6x.uk
X-Forwarded-Proto: https
X-Forwarded-For: 127.0.0.1
Via: https/1.1 lnxdev[62707c09-39fb-4c99-8074-e5d3a84552e4] (ApacheTrafficServer/7.1.0)


05:20:55.989177 IP 172.28.5.2.8080 > 172.31.231.2.45060: Flags [.], ack 281, win 235, options [nop,nop,TS val 85374358 ecr 13254523], length 0
E..4w.@.@.~.............>..V.*......Dg.....
......?{
05:20:55.989487 IP 172.28.5.2.8080 > 172.31.231.2.45060: Flags [P.], seq 1:770, ack 281, win 235, options [nop,nop,TS val 85374359 ecr 13254523], length 769: HTTP: HTTP/1.1 200 OK
E..5w.@.@.{.............>..V.*......Gh.....
......?{HTTP/1.1 200 OK
```

In either case, sending Content-Length in the request fixes the problem.  For comparison, both curl commands work fine when run against https://requestb.in.

**Comment by unixwitch** [comment]
This is the request TS actually sent to the origin in the Docker case:

```
..O....hPATCH /v2/sysadmin/devpi/blobs/uploads/86bd0310-b97a-4911-a79a-d52f006a4781?_state=<redacted> HTTP/1.1
User-Agent: docker/17.03.1-ce go/go1.7.5 git-commit/c6d412e kernel/4.9.0-3-amd64 os/linux arch/amd64 UpstreamClient(Docker-Client/17.03.1-ce \(linux\))
Transfer-Encoding: chunked
Authorization: Bearer <redacted>
Host: registry.git.torchbox.com
X-Forwarded-Proto: https
X-Forwarded-For: 193.227.244.123
Via: https/1.1 master-c.c.kube-prod.internal[9e0b0af2-d115-4100-92b2-fdb40c79ce4a] (ApacheTrafficServer/7.1.0)


04:40:22.663402 IP 172.28.5.4.5000 > 172.31.216.9.47572: Flags [.], ack 1522, win 251, options [nop,nop,TS val 82941033 ecr 261246858], length 0
E..4+R@.@..(.......     ....K..:MTa.....5p.....
...i..O.
04:40:22.663390 IP 172.31.216.9.47572 > 172.28.5.4.5000: Flags [P.], seq 1522:1528, ack 1, win 222, options [nop,nop,TS val 261246858 ecr 82941032], length 6
E..:..@.?...... ........MTa.K..:....x......
..O....h1
.

04:40:22.663407 IP 172.28.5.4.5000 > 172.31.216.9.47572: Flags [.], ack 1528, win 251, options [nop,nop,TS val 82941033 ecr 261246858], length 0
E..4+S@.@..'.......     ....K..:MTa!....5p.....
...i..O.
04:40:22.665426 IP 172.31.216.9.47572 > 172.28.5.4.5000: Flags [P.], seq 1528:5065, ack 1, win 222, options [nop,nop,TS val 261246860 ecr 82941033], length 3537
E.....@.?...... ........MTa!K..:....CA.....
..O....i7fff
....    n......|T..8>.d1Y ....u..$.].! ..w!....IP.?.f.n...]......I,...kmk..{.}}~}}}}..Z.Q!.%.V..S......".U.?......{w!j..........33g..9.....s[....K...W._7u*).........S*..WVL#...r.TB.~...'.Q.
)/.k.d.......K4..........z....6...+..O.Rq.}..Rn.O.ZI.........5uss....Cf...W;.v
--
......d.HTTP/1.1 500 Internal Server Error
Content-Type: application/json; charset=utf-8
Docker-Distribution-Api-Version: registry/2.0
X-Content-Type-Options: nosniff
Date: Tue, 06 Jun 2017 04:41:33 GMT
Content-Length: 70
Connection: close

{"errors":[{"code":"UNKNOWN","message":"unknown error","detail":{}}]}
```

This is a bit different from my curl test case, so I'm not sure I'm reproducing it properly - TS does send the chunked TE origin header here.

**Comment by zwoop** [comment]
@maskit or @masaori335 thoughts?

**Comment by masaori335** [comment]
It looks like curl doesn't send `Content-Length` or `Transfer-Encoding` header when `-H'Transfer-Encoding: chunked'` option is used with HTTP/2 (regardless POST or PATCH method). And TS doesn't support this situation.
I guess the issue with docker client is similar. TS sends data of HTTP/2 DATA frame as request body to origin server. Probably TS needs to convert them to chunks. ( BTW, sending `Transfer-Encoding` header on HTTP/2 looks RFC violation. )

We need to support chunked request on HTTP/2 and what we need to do is below.
1) add 'Transfer-Encoding: chunked' header after convert to HTTP/1.1 request
2) convert DATA frames to chunked
3) tests by autest

**Comment by masaori335** [comment]
@unixwitch IMO, 7.0.x and 6.2.x has same issue. WDYT?

**Comment by unixwitch** [comment]
I can't easily test 7.0 because it doesn't build on my development system (OpenSSL 1.1.0), but we've been using TS 7.0 + HTTP/2 + Docker Registry for a few months and never noticed any problems until upgrading to 7.1.  I'll try to find somewhere with an older OS so I can build 7.0 and test it... 

> sending Transfer-Encoding header on HTTP/2 looks RFC violation

`curl -H'Transfer-Encoding: chunked'` doesn't actually send T-E on HTTP/2 - it's a magic flag to tell it not to send content-length, to retain compatibility with HTTP/1.1.  (https://github.com/curl/curl/issues/662)

**Comment by masaori335** [comment]
- 7.0 vs 7.1
Hmm, I might be missing something. Another wild guess is that behavior of docker client is changed recently. 

- Transfer-Encoding Header
Yes, curl doesn't send T-E header on HTTP/2. I intended to talk about docker client.
From your log, it looks like docker client is sending T-E header on HTTP/2.

**Comment by unixwitch** [comment]
Okay, this is broken on 7.0 as well, although I'm not sure why we didn't notice it.

HTTP/1.1:

```
% cat /etc/hosts | curl --http1.1 -H'Transfer-Encoding: chunked' -vksSi -XPATCH -d@- --resolve echoheaders.gce.t6x.uk:6443:127.0.0.1 https://echoheaders.gce.t6x.uk:6443/
* Added echoheaders.gce.t6x.uk:6443:127.0.0.1 to DNS cache
* Hostname echoheaders.gce.t6x.uk was found in DNS cache
*   Trying 127.0.0.1...
* TCP_NODELAY set
* Connected to echoheaders.gce.t6x.uk (127.0.0.1) port 6443 (#0)
* ALPN, offering http/1.1
* Cipher selection: ALL:!EXPORT:!EXPORT40:!EXPORT56:!aNULL:!LOW:!RC4:@STRENGTH
* successfully set certificate verify locations:
*   CAfile: /etc/ssl/certs/ca-certificates.crt
  CApath: /etc/ssl/certs
* TLSv1.2 (OUT), TLS header, Certificate Status (22):
* TLSv1.2 (OUT), TLS handshake, Client hello (1):
* TLSv1.2 (IN), TLS handshake, Server hello (2):
* NPN, negotiated HTTP1.1
* TLSv1.2 (IN), TLS handshake, Certificate (11):
* TLSv1.2 (IN), TLS handshake, Server key exchange (12):
* TLSv1.2 (IN), TLS handshake, Server finished (14):
* TLSv1.2 (OUT), TLS handshake, Client key exchange (16):
* TLSv1.2 (OUT), TLS change cipher, Client hello (1):
* TLSv1.2 (OUT), TLS handshake, Unknown (67):
* TLSv1.2 (OUT), TLS handshake, Finished (20):
* TLSv1.2 (IN), TLS change cipher, Client hello (1):
* TLSv1.2 (IN), TLS handshake, Finished (20):
* SSL connection using TLSv1.2 / ECDHE-RSA-AES256-GCM-SHA384
* ALPN, server did not agree to a protocol
* Server certificate:
*  subject: CN=echoheaders.gce.t6x.uk
*  start date: May 24 12:05:00 2017 GMT
*  expire date: Aug 22 12:05:00 2017 GMT
*  issuer: C=US; O=Let's Encrypt; CN=Let's Encrypt Authority X3
*  SSL certificate verify ok.
> PATCH / HTTP/1.1
> Host: echoheaders.gce.t6x.uk:6443
> User-Agent: curl/7.52.1
> Accept: */*
> Transfer-Encoding: chunked
> Content-Type: application/x-www-form-urlencoded
> 
> e8
* upload completely sent off: 239 out of 232 bytes
< HTTP/1.1 200 OK
HTTP/1.1 200 OK
< Server: ATS/7.0.0
Server: ATS/7.0.0
< Date: Wed, 07 Jun 2017 10:10:46 GMT
Date: Wed, 07 Jun 2017 10:10:46 GMT
< Content-Type: text/plain
Content-Type: text/plain
< Age: 0
Age: 0
< Transfer-Encoding: chunked
Transfer-Encoding: chunked
< Connection: keep-alive
Connection: keep-alive

< 
CLIENT VALUES:
client_address=172.31.231.2
command=PATCH
real path=/
query=nil
request_version=1.1
request_uri=http://echoheaders.gce.t6x.uk:8080/

SERVER VALUES:
server_version=nginx: 1.10.0 - lua: 10001

HEADERS RECEIVED:
accept=*/*
client-ip=172.17.0.1
content-type=application/x-www-form-urlencoded
host=echoheaders.gce.t6x.uk:6443
transfer-encoding=chunked
user-agent=curl/7.52.1
via=https/1.1 200591939db7[7c6f59fb-7e2b-4748-9e7f-01421fd618c1] (ApacheTrafficServer/7.0.0)
x-forwarded-for=172.17.0.1
BODY:
* Curl_http_done: called premature == 0
* Connection #0 to host echoheaders.gce.t6x.uk left intact
127.0.0.1       localhost127.0.1.1      lnxdev.home     lnxdev# The following lines are desirable for IPv6 capable hosts::1     localhost ip6-localhost ip6-loopbackff02::1 ip6-allnodesff02::2 ip6-allrouters10.10.0.1 ilythia10.10.0.2 generator.test%                        
```
```
11:10:46.624376 IP 10.10.0.2.37012 > 172.28.9.131.8080: Flags [P.], seq 1:318, ack 1, win 229, options [nop,nop,TS val 39189172 ecr 75073043], length 317: HTTP
E..q..@.?.g.

....    .....p..S..^$...........
.U...y..PATCH / HTTP/1.1
Host: echoheaders.gce.t6x.uk:6443
User-Agent: curl/7.52.1
Accept: */*
Transfer-Encoding: chunked
Content-Type: application/x-www-form-urlencoded
Client-ip: 172.17.0.1
X-Forwarded-For: 172.17.0.1
Via: https/1.1 200591939db7[7c6f59fb-7e2b-4748-9e7f-01421fd618c1] (ApacheTrafficServer/7.0.0)
```

HTTP/2:

```
% cat /etc/hosts | curl  -H'Transfer-Encoding: chunked' -vksSi -XPATCH -d@- --resolve echoheaders.gce.t6x.uk:6443:127.0.0.1 https://echoheaders.gce.t6x.uk:6443/
* Added echoheaders.gce.t6x.uk:6443:127.0.0.1 to DNS cache
* Hostname echoheaders.gce.t6x.uk was found in DNS cache
*   Trying 127.0.0.1...
* TCP_NODELAY set
* Connected to echoheaders.gce.t6x.uk (127.0.0.1) port 6443 (#0)
* ALPN, offering h2
* ALPN, offering http/1.1
* Cipher selection: ALL:!EXPORT:!EXPORT40:!EXPORT56:!aNULL:!LOW:!RC4:@STRENGTH
* successfully set certificate verify locations:
*   CAfile: /etc/ssl/certs/ca-certificates.crt
  CApath: /etc/ssl/certs
* TLSv1.2 (OUT), TLS header, Certificate Status (22):
* TLSv1.2 (OUT), TLS handshake, Client hello (1):
* TLSv1.2 (IN), TLS handshake, Server hello (2):
* NPN, negotiated HTTP2 (h2)
* TLSv1.2 (IN), TLS handshake, Certificate (11):
* TLSv1.2 (IN), TLS handshake, Server key exchange (12):
* TLSv1.2 (IN), TLS handshake, Server finished (14):
* TLSv1.2 (OUT), TLS handshake, Client key exchange (16):
* TLSv1.2 (OUT), TLS change cipher, Client hello (1):
* TLSv1.2 (OUT), TLS handshake, Unknown (67):
* TLSv1.2 (OUT), TLS handshake, Finished (20):
* TLSv1.2 (IN), TLS change cipher, Client hello (1):
* TLSv1.2 (IN), TLS handshake, Finished (20):
* SSL connection using TLSv1.2 / ECDHE-RSA-AES256-GCM-SHA384
* ALPN, server did not agree to a protocol
* Server certificate:
*  subject: CN=echoheaders.gce.t6x.uk
*  start date: May 24 12:05:00 2017 GMT
*  expire date: Aug 22 12:05:00 2017 GMT
*  issuer: C=US; O=Let's Encrypt; CN=Let's Encrypt Authority X3
*  SSL certificate verify ok.
* Using HTTP2, server supports multi-use
* Connection state changed (HTTP/2 confirmed)
* Copying HTTP/2 data in stream buffer to connection buffer after upgrade: len=0
* Using Stream ID: 1 (easy handle 0x55f9a763dd60)
> PATCH / HTTP/1.1
> Host: echoheaders.gce.t6x.uk:6443
> User-Agent: curl/7.52.1
> Accept: */*
> Content-Type: application/x-www-form-urlencoded
> 
* We are completely uploaded and fine
* Connection state changed (MAX_CONCURRENT_STREAMS updated)!
< HTTP/2 200 
HTTP/2 200 
< server: ATS/7.0.0
server: ATS/7.0.0
< date: Wed, 07 Jun 2017 10:12:24 GMT
date: Wed, 07 Jun 2017 10:12:24 GMT
< content-type: text/plain
content-type: text/plain
< age: 0
age: 0

< 
CLIENT VALUES:
client_address=172.31.231.2
command=PATCH
real path=/
query=nil
request_version=1.1
request_uri=http://echoheaders.gce.t6x.uk:8080/

SERVER VALUES:
server_version=nginx: 1.10.0 - lua: 10001

HEADERS RECEIVED:
accept=*/*
client-ip=172.17.0.1
content-type=application/x-www-form-urlencoded
host=echoheaders.gce.t6x.uk:6443
user-agent=curl/7.52.1
via=https/1.1 200591939db7[7c6f59fb-7e2b-4748-9e7f-01421fd618c1] (ApacheTrafficServer/7.0.0)
x-forwarded-for=172.17.0.1
BODY:
* Curl_http_done: called premature == 0
* Connection #0 to host echoheaders.gce.t6x.uk left intact
-no body in request-                                                                                                          
```

```
11:12:24.214706 IP 10.10.0.2.37024 > 172.28.9.131.8080: Flags [P.], seq 1:290, ack 1, win 229, options [nop,nop,TS val 39213557 ecr 75170632], length 289: HTTP
E..Uz.@.?...

....    .......#.p..............
.VY..{.HPATCH / HTTP/1.1
User-Agent: curl/7.52.1
Accept: */*
Content-Type: application/x-www-form-urlencoded
Host: echoheaders.gce.t6x.uk:6443
Client-ip: 172.17.0.1
X-Forwarded-For: 172.17.0.1
Via: https/1.1 200591939db7[7c6f59fb-7e2b-4748-9e7f-01421fd618c1] (ApacheTrafficServer/7.0.0)
```

I can reproduce with nghttp2 too:

```
lnxdev# nghttp -v https://echoheaders.gce.t6x.uk:6443 -d/etc/hosts -H':method: PATCH'                    
[  0.000] Connected
[  0.002][NPN] server offers:
          * h2
          * http/1.1
          * http/1.0
The negotiated protocol: h2
[  0.004] recv SETTINGS frame <length=12, flags=0x00, stream_id=0>
          (niv=2)
          [SETTINGS_MAX_CONCURRENT_STREAMS(0x03):100]
          [SETTINGS_INITIAL_WINDOW_SIZE(0x04):1048576]
[  0.004] recv WINDOW_UPDATE frame <length=4, flags=0x00, stream_id=0>
          (window_size_increment=983041)
[  0.004] send SETTINGS frame <length=12, flags=0x00, stream_id=0>
          (niv=2)
          [SETTINGS_MAX_CONCURRENT_STREAMS(0x03):100]
          [SETTINGS_INITIAL_WINDOW_SIZE(0x04):65535]
[  0.004] send SETTINGS frame <length=0, flags=0x01, stream_id=0>
          ; ACK
          (niv=0)
[  0.004] send PRIORITY frame <length=5, flags=0x00, stream_id=3>
          (dep_stream_id=0, weight=201, exclusive=0)
[  0.004] send PRIORITY frame <length=5, flags=0x00, stream_id=5>
          (dep_stream_id=0, weight=101, exclusive=0)
[  0.004] send PRIORITY frame <length=5, flags=0x00, stream_id=7>
          (dep_stream_id=0, weight=1, exclusive=0)
[  0.004] send PRIORITY frame <length=5, flags=0x00, stream_id=9>
          (dep_stream_id=7, weight=1, exclusive=0)
[  0.004] send PRIORITY frame <length=5, flags=0x00, stream_id=11>
          (dep_stream_id=3, weight=1, exclusive=0)
[  0.004] send HEADERS frame <length=60, flags=0x24, stream_id=13>
          ; END_HEADERS | PRIORITY
          (padlen=0, dep_stream_id=11, weight=16, exclusive=0)
          ; Open new stream
          :method: PATCH
          :path: /
          :scheme: https
          :authority: echoheaders.gce.t6x.uk:6443
          accept: */*
          accept-encoding: gzip, deflate
          user-agent: nghttp2/1.18.1
          content-length: 265
[  0.004] send DATA frame <length=265, flags=0x01, stream_id=13>
          ; END_STREAM
[  0.004] recv SETTINGS frame <length=0, flags=0x01, stream_id=0>
          ; ACK
          (niv=0)
[  0.072] recv (stream_id=13) :status: 200
[  0.072] recv (stream_id=13) server: ATS/7.0.0
[  0.072] recv (stream_id=13) date: Wed, 07 Jun 2017 10:18:18 GMT
[  0.072] recv (stream_id=13) content-type: text/plain
[  0.072] recv (stream_id=13) age: 0
[  0.072] recv HEADERS frame <length=46, flags=0x04, stream_id=13>
          ; END_HEADERS
          (padlen=0)
          ; First response header
CLIENT VALUES:
client_address=172.31.231.2
command=PATCH
real path=/
query=nil
request_version=1.1
request_uri=http://echoheaders.gce.t6x.uk:8080/

SERVER VALUES:
server_version=nginx: 1.10.0 - lua: 10001

HEADERS RECEIVED:
accept=*/*
accept-encoding=gzip, deflate
client-ip=10.10.0.2
content-length=265
host=echoheaders.gce.t6x.uk:6443
user-agent=nghttp2/1.18.1
via=https/1.1 200591939db7[7c6f59fb-7e2b-4748-9e7f-01421fd618c1] (ApacheTrafficServer/7.0.0)
x-forwarded-for=10.10.0.2
BODY:
127.0.0.1       localhost
127.0.1.1       lnxdev.home     lnxdev

# The following lines are desirable for IPv6 capable hosts
::1     localhost ip6-localhost ip6-loopback
ff02::1 ip6-allnodes
ff02::2 ip6-allrouters

10.10.0.1 ilythia
10.10.0.2 generator.test echoheaders.gce.t6x.uk
[  0.072] recv DATA frame <length=753, flags=0x01, stream_id=13>
          ; END_STREAM
[  0.072] send GOAWAY frame <length=8, flags=0x00, stream_id=0>
          (last_stream_id=0, error_code=NO_ERROR(0x00), opaque_data(0)=[])
```

```
lnxdev# nghttp -v https://echoheaders.gce.t6x.uk:6443 -d/etc/hosts -H':method: PATCH' --no-content-length
[  0.000] Connected
[  0.002][NPN] server offers:
          * h2
          * http/1.1
          * http/1.0
The negotiated protocol: h2
[  0.003] recv SETTINGS frame <length=12, flags=0x00, stream_id=0>
          (niv=2)
          [SETTINGS_MAX_CONCURRENT_STREAMS(0x03):100]
          [SETTINGS_INITIAL_WINDOW_SIZE(0x04):1048576]
[  0.003] recv WINDOW_UPDATE frame <length=4, flags=0x00, stream_id=0>
          (window_size_increment=983041)
[  0.003] send SETTINGS frame <length=12, flags=0x00, stream_id=0>
          (niv=2)
          [SETTINGS_MAX_CONCURRENT_STREAMS(0x03):100]
          [SETTINGS_INITIAL_WINDOW_SIZE(0x04):65535]
[  0.003] send SETTINGS frame <length=0, flags=0x01, stream_id=0>
          ; ACK
          (niv=0)
[  0.003] send PRIORITY frame <length=5, flags=0x00, stream_id=3>
          (dep_stream_id=0, weight=201, exclusive=0)
[  0.003] send PRIORITY frame <length=5, flags=0x00, stream_id=5>
          (dep_stream_id=0, weight=101, exclusive=0)
[  0.003] send PRIORITY frame <length=5, flags=0x00, stream_id=7>
          (dep_stream_id=0, weight=1, exclusive=0)
[  0.003] send PRIORITY frame <length=5, flags=0x00, stream_id=9>
          (dep_stream_id=7, weight=1, exclusive=0)
[  0.003] send PRIORITY frame <length=5, flags=0x00, stream_id=11>
          (dep_stream_id=3, weight=1, exclusive=0)
[  0.003] send HEADERS frame <length=54, flags=0x24, stream_id=13>
          ; END_HEADERS | PRIORITY
          (padlen=0, dep_stream_id=11, weight=16, exclusive=0)
          ; Open new stream
          :method: PATCH
          :path: /
          :scheme: https
          :authority: echoheaders.gce.t6x.uk:6443
          accept: */*
          accept-encoding: gzip, deflate
          user-agent: nghttp2/1.18.1
[  0.003] send DATA frame <length=265, flags=0x01, stream_id=13>
          ; END_STREAM
[  0.004] recv SETTINGS frame <length=0, flags=0x01, stream_id=0>
          ; ACK
          (niv=0)
[  0.070] recv (stream_id=13) :status: 200
[  0.070] recv (stream_id=13) server: ATS/7.0.0
[  0.070] recv (stream_id=13) date: Wed, 07 Jun 2017 10:18:50 GMT
[  0.070] recv (stream_id=13) content-type: text/plain
[  0.070] recv (stream_id=13) age: 1
[  0.070] recv HEADERS frame <length=46, flags=0x04, stream_id=13>
          ; END_HEADERS
          (padlen=0)
          ; First response header
CLIENT VALUES:
client_address=172.31.231.2
command=PATCH
real path=/
query=nil
request_version=1.1
request_uri=http://echoheaders.gce.t6x.uk:8080/

SERVER VALUES:
server_version=nginx: 1.10.0 - lua: 10001

HEADERS RECEIVED:
accept=*/*
accept-encoding=gzip, deflate
client-ip=10.10.0.2
host=echoheaders.gce.t6x.uk:6443
user-agent=nghttp2/1.18.1
via=https/1.1 200591939db7[7c6f59fb-7e2b-4748-9e7f-01421fd618c1] (ApacheTrafficServer/7.0.0)
x-forwarded-for=10.10.0.2
BODY:
-no body in request-[  0.071] recv DATA frame <length=489, flags=0x01, stream_id=13>
          ; END_STREAM
[  0.071] send GOAWAY frame <length=8, flags=0x00, stream_id=0>
          (last_stream_id=0, error_code=NO_ERROR(0x00), opaque_data(0)=[])
```

**Comment by masaori335** [comment]
@unixwitch Thanks for testing v7.0.

**Comment by unixwitch** [comment]
I haven't been able to reproduce the Docker problem in development: Docker uses HTTP/1.1 regardless of TS configuration and works correctly.  I'm going to re-enable HTTP/2 in staging to confirm that's actually the problem, but that'll have to wait until close of business (about 6 hours hence). 

(Regardless, I think the behaviour demonstrated by curl is an actual bug.)

**Comment by shinrich** [comment]
I ran into this issue while trying to exercise grpc through ATS (in conjunction with the HTTP/2 to origin work).  And re-derived the same curl request as @unixwitch as a small tests.  grpc seems to set POST requests with no content length which causes ATS to return a 411 code.

The solution that @masaori335 outlined seems right, and I'll go ahead an proceed with that unless someone already has that fix on a branch somewhere.

**Comment by bryancall** [comment]
If this is still an issue please reopen.
